<?xml version="1.0" encoding="UTF-8"?>
<root xmlns:xsi="http://www.w3.org/2001/XMLSchema-instance" xsi:noNamespaceSchemaLocation="niveau.xsd">
  <niveau nbContext="0" nbDifficulte="0" nbNiveau="0">
    <description>000000000000</description>
  </niveau>
  <niveau nbContext="0" nbDifficulte="0" nbNiveau="1">
    <description>000000000000</description>
  </niveau>
  <niveau nbContext="0" nbDifficulte="0" nbNiveau="2">
    <description>000000000000</description>
  </niveau>
  <niveau nbContext="0" nbDifficulte="0" nbNiveau="3">
    <description>000000000000</description>
  </niveau>
  <niveau nbContext="0" nbDifficulte="0" nbNiveau="4">
    <description>000000000000</description>
  </niveau>
  <niveau nbContext="0" nbDifficulte="0" nbNiveau="5">
    <description>000000000000</description>
  </niveau>
  <niveau nbContext="0" nbDifficulte="1" nbNiveau="0">
    <description>000000000000</description>
  </niveau>
  <niveau nbContext="0" nbDifficulte="1" nbNiveau="1">
    <description>000000000000</description>
  </niveau>
  <niveau nbContext="0" nbDifficulte="1" nbNiveau="2">
    <description>000000000000</description>
  </niveau>
  <niveau nbContext="0" nbDifficulte="1" nbNiveau="3">
    <description>000000000000</description>
  </niveau>
  <niveau nbContext="0" nbDifficulte="1" nbNiveau="4">
    <description>000000000000</description>
  </niveau>
  <niveau nbContext="0" nbDifficulte="1" nbNiveau="5">
    <description>000000000000</description>
  </niveau>
  <niveau nbContext="0" nbDifficulte="2" nbNiveau="0">
    <description>000000000000</description>
  </niveau>
  <niveau nbContext="0" nbDifficulte="2" nbNiveau="1">
    <description>000000000000</description>
  </niveau>
  <niveau nbContext="0" nbDifficulte="2" nbNiveau="2">
    <description>000000000000</description>
  </niveau>
  <niveau nbContext="0" nbDifficulte="2" nbNiveau="3">
    <description>000000000000</description>
  </niveau>
  <niveau nbContext="0" nbDifficulte="2" nbNiveau="4">
    <description>000000000000</description>
  </niveau>
  <niveau nbContext="0" nbDifficulte="2" nbNiveau="5">
    <description>000000000000</description>
  </niveau>
  <niveau nbContext="0" nbDifficulte="3" nbNiveau="0">
    <description>000000000000</description>
  </niveau>
  <niveau nbContext="0" nbDifficulte="3" nbNiveau="1">
    <description>000000000000</description>
  </niveau>
  <niveau nbContext="0" nbDifficulte="3" nbNiveau="2">
    <description>000000000000</description>
  </niveau>
  <niveau nbContext="0" nbDifficulte="3" nbNiveau="3">
    <description>000000000000</description>
  </niveau>
  <niveau nbContext="0" nbDifficulte="3" nbNiveau="4">
    <description>000000000000</description>
  </niveau>
  <niveau nbContext="0" nbDifficulte="3" nbNiveau="5">
    <description>000000000000</description>
  </niveau>
  <niveau nbContext="1" nbDifficulte="0" nbNiveau="0">
    <description>000000000000</description>
  </niveau>
  <niveau nbContext="1" nbDifficulte="0" nbNiveau="1">
    <description>000000000000</description>
  </niveau>
  <niveau nbContext="1" nbDifficulte="0" nbNiveau="2">
    <description>000000000000</description>
  </niveau>
  <niveau nbContext="1" nbDifficulte="0" nbNiveau="3">
    <description>000000000000</description>
  </niveau>
  <niveau nbContext="1" nbDifficulte="0" nbNiveau="4">
    <description>000000000000</description>
  </niveau>
  <niveau nbContext="1" nbDifficulte="0" nbNiveau="5">
    <description>000000000000</description>
  </niveau>
  <niveau nbContext="1" nbDifficulte="1" nbNiveau="0">
    <description>000000000000</description>
  </niveau>
  <niveau nbContext="1" nbDifficulte="1" nbNiveau="1">
    <description>000000000000</description>
  </niveau>
  <niveau nbContext="1" nbDifficulte="1" nbNiveau="2">
    <description>000000000000</description>
  </niveau>
  <niveau nbContext="1" nbDifficulte="1" nbNiveau="3">
    <description>000000000000</description>
  </niveau>
  <niveau nbContext="1" nbDifficulte="1" nbNiveau="4">
    <description>000000000000</description>
  </niveau>
  <niveau nbContext="1" nbDifficulte="1" nbNiveau="5">
    <description>000000000000</description>
  </niveau>
  <niveau nbContext="1" nbDifficulte="2" nbNiveau="0">
    <description>000000000000</description>
  </niveau>
  <niveau nbContext="1" nbDifficulte="2" nbNiveau="1">
    <description>000000000000</description>
  </niveau>
  <niveau nbContext="1" nbDifficulte="2" nbNiveau="2">
    <description>000000000000</description>
  </niveau>
  <niveau nbContext="1" nbDifficulte="2" nbNiveau="3">
    <description>000000000000</description>
  </niveau>
  <niveau nbContext="1" nbDifficulte="2" nbNiveau="4">
    <description>000000000000</description>
  </niveau>
  <niveau nbContext="1" nbDifficulte="2" nbNiveau="5">
    <description>000000000000</description>
  </niveau>
  <niveau nbContext="1" nbDifficulte="3" nbNiveau="0">
    <description>000000000000</description>
  </niveau>
  <niveau nbContext="1" nbDifficulte="3" nbNiveau="1">
    <description>000000000000</description>
  </niveau>
  <niveau nbContext="1" nbDifficulte="3" nbNiveau="2">
    <description>000000000000</description>
  </niveau>
  <niveau nbContext="1" nbDifficulte="3" nbNiveau="3">
    <description>000000000000</description>
  </niveau>
  <niveau nbContext="1" nbDifficulte="3" nbNiveau="4">
    <description>000000000000</description>
  </niveau>
  <niveau nbContext="1" nbDifficulte="3" nbNiveau="5">
    <description>000000000000</description>
  </niveau>
</root>
